,Name,All Critics Reviews,Rotten/Fresh,Date
148,Michael Wilmington,"James Cameron's 194-minute, $200 million film of the tragic voyage is in the tradition of the great Hollywood epics. It is flawlessly crafted, intelligently constructed, strongly acted and spellbinding.",fresh,"January 1, 2000"
149,MaryAnn Johanson,"Titanic is a film that sweeps us away into a world of spectacle, beauty and excitement.",fresh,"January 1, 2000"
150,Ed Kelleher,"Watching the film again, it suddenly struck me with the force of a pop-culture hurricane: Titanic is all about Rose. It is Rose's personal journey. This hardly ever happens in films...",fresh,"January 1, 2000"
151,Owen Gleiberman,Titanic is a remarkable achievement.,fresh,"January 1, 2000"
152,Janet Maslin,A lush and terrifying spectacle of romantic doom.,fresh,"January 1, 2000"
153,Nell Minow,"Cameron succeeds magically in linking his film's young lovers, played enchantingly by Leonardo DiCaprio and Kate Winslet.",fresh,"January 1, 2000"
154,Bruce Kirkland,Who'd have thought that the most expensive film ever made could also be good cinema?,fresh,"January 1, 2000"
155,Carlo Cavagna,The movie raises important questions about choices faced by the characters.,fresh,"January 1, 2000"
156,Jack Garner,James Cameron has made a miracle movie that delivers big-time.,fresh,"January 1, 2000"
157,Marty Mapes,The genius of Titanic does not lie in the story itself. It lies in how the story is told.,fresh,"January 1, 2000"
158,Matt Easterbrook,You've never seen a film of more stunning visual splendor.,fresh,"January 1, 2000"
159,Madeleine Williams,The melodramatic love story is the perfect foreground for the sinking of the largest passenger ship in history.,fresh,"January 1, 2000"
160,Adam Smith,"Forgive me if I gush too much, for I have just come back from seeing one of the five best films ever made.",fresh,"January 1, 2000"
161,Mike McGranaghan,"Titanic is one of his best, and raises the bar yet again.",fresh,"January 1, 2000"
162,Michael Dequina,"James Cameron has gone and delivered a spectacular, moving, utterly engrossing three-and-a-bit hour epic.",fresh,"January 1, 2000"
163,Ted Prigge,"Titanic is not a perfect film, but it is a great film nonetheless.",fresh,"January 1, 2000"
164,Widgett Walls,"This absorbing, moving cinematic spectacle not only floats, it soars.",fresh,"January 1, 2000"
165,David Keyes,A wonderful masterpiece of a film.,fresh,"January 1, 2000"
166,Rob Blackwelder,To take the space to try to convey to you all of the things that Cameron did right with this film would basically wipe out my alloted server storage.,fresh,"January 1, 2000"
167,Ian Mantgani,"Titanic is one of those flawless, spellbinding epics that we all know and love.",fresh,"January 1, 2000"
168,Frank Ochieng,"It is opulent, daring, detailed, vastly over-priced and incomparable.",fresh,"January 1, 2000"
169,Shane Burridge,The best film of its genre ever made.,fresh,"January 1, 2000"
170,Mark R. Leeper,"What Cameron does is essentially give us a history lesson in an empowering, emphatic, entertaining way. This extraordinary flick feels like a big event with a litany of emblematic scope and impressive visual vitality.",fresh,"January 1, 2000"
171,David N. Butterworth,This man makes the bluest looking movies around,fresh,"January 1, 2000"
172,Jeff Millar,This is a big film with a lot to like as well as a lot to not.,fresh,"January 1, 2000"
173,Scott Renshaw,"Time skips by quickly, and there are more than a few decent supporting performances to enjoy.",fresh,"January 1, 2000"
174,Kristian M. Lin,Titanic will give you your money's worth.,fresh,"January 1, 2000"
175,Tom Keogh,May be the year's most effective and consistently entertaining love story.,fresh,"January 1, 2000"
176,Peter Rainer,"The movie's human elements are entirely stale, however appealingly packaged.",rotten,"January 1, 2000"
177,Christopher Null,The would-be emotional centerpiece of his three-hours-plus adventure flick is the most juvenile romantic tale of 1997.,rotten,"January 1, 2000"
178,Harvey S. Karten,There's a lot to like here.,fresh,"January 1, 2000"
179,Steve Rhodes,"Whatever it's pigeon-holed as, you're going to love the movie.",fresh,"January 1, 2000"
180,Peter Brunette,"It is perhaps the best example in 1997 of a film which is pure, simple melodrama.",fresh,"January 1, 2000"
181,Bryant Frazer,It is filmmaking at its best.,fresh,"January 1, 2000"
182,Dan Jardine,The disaster is definitely worth the wait.,fresh,"January 1, 2000"
183,Cynthia Fuchs,It's clear that Titanic will be a technophile's delight.,fresh,"January 1, 2000"
184,Joseph McBride,"Titanic is a great, soft-hearted traditional epic.",fresh,"January 1, 2000"
185,Stanley Kauffmann,"This disaster-action-adventure-romance flick combines epic aspiration with cartoonish simplicity, with no qualms about going for the popular jugular, jerking tears and cheers with equal obviousness.",rotten,"January 1, 2000"
186,Robert Horton,"Like a David Lean film, it is an intimate epic with a moving and resonant love story at its core.",fresh,"January 1, 2000"
187,Susan Stark,"Bursting through gaps in the hull, rushing down corridors, licking at rooms, triumphing over great ballrooms and tiny closets, down stairways and into elevators, the sea, in the hands of Cameron and his technical associates, becomes hungry, vindictive.",fresh,"January 1, 2000"
188,Mick LaSalle,"Like it or hate it, Titanic lives and breathes as a piece of pure cinema.",fresh,"January 1, 2000"
189,Richard Corliss,"As spectacle, Titanic sets a new standard; as romantic drama, it's substandard.",rotten,"January 1, 2000"
190,Scott Nash,"The last hour of Titanic is huge and staggering, but there's no horror in it.",rotten,"January 1, 2000"
