review_text,review_date,review_stars,review_flavor
Throughs decent heat after it’s been on for 15-20 minutes.  Nice and quiet and connected to WiFi seamlessly.  Nice little heater!,"Reviewed in the United States on April 20, 2024",5.0 out of 5 stars,Color: WHITE Wi-FiPattern Name: Infrared Heater
Last fall I moved into a tiny house that is 12x20.  I didn't know if this heater would keep it warm but it performed perfectly.  We have a week or two of 0° or below and it kept it warm even when the dog was going in and out of the doggie door!  The one negative thing is it raised my electric bill significantly.  But because it's price was fantasticily Iow I can't complain because I don't know how other higher price heaters work or how much electricity they use.  It ran quietly and the automatic control kept very even temperature.  I highly recommend this heater for small spaces.,"Reviewed in the United States on May 8, 2024",5.0 out of 5 stars,Color: WHITE Wi-FiPattern Name: Infrared Heater
These are really nice. Bluetooth and remote capabilities. They heat small rooms well. We got 3 for our basement rooms and they do a great job! Price is amazing and good quality. Also sits on the floor or wall mount is nice.,"Reviewed in the United States on April 25, 2024",5.0 out of 5 stars,Color: WHITE Wi-FiPattern Name: Infrared Heater
"**SECOND UPDATE**the LCD display has begun to die; many smart heaters don't even have a display at all. one of the reasons i settled on this one was because it does. if this unit only lasts a year, i'm not going to be happy at all.**UPDATE**it's been a year since i installed this heater and i'm very glad i did. i bought several different portable heaters and none worked as well or as consistently. temps have been near freezing for the past week and my she-shed (unit set to 62) has maintained a temp of 61/62. wifi connection is reliable (shed is about 30' from the router in the house but i installed an extender in the shed). VERY happy.**ORIGINAL REVIEW**live in coastal virginia; the last few days we've had temps in the low 20's. the walls and ceiling in my shed are insulated, but not the floor. the shed is 12x20.  i've tried several different heaters, just trying to get temps inside in the 50's so the water pipes don't freeze. wanted a heater that had wifi, so i didn't have to go out in the shed to turn on a heater if the weather was bad.SO glad i found this one!!!PROS: having reliable wifi is huge. installed about 2 weeks ago; it hasn't dropped its wifi connection once. alexa and google integration is great. easy installation with the template that has a tiny cute little level at the top. fairly lightweight at about 9 pounds. puts out a good amount of heat, but even more important is that it does a fantastic job maintaining the set temperature. it's been in the high teens/low twenties but the heater has kept the shed at 68 - very impressive. has a lock feature on the display.CONS: few, but worth mentioning. short power cable (i had problems trying to wall mount where i wanted  and still reach an outlet). the plug on the power cord is kind of goofy; it's low profile, but the cable comes out on the side, not the top or bottom. i had to calibrate the temp display more than once to get it to sync with a thermometer i have next to it.  if i ask ""alexa what is the temperature in the shed?"", she says sorry, but shed doesn't support that. but if i ask google the same question, she tells me what the heater is set to and the current temp. last comment is that, even tho this is a great unit that does a wonderful job heating my small space, i still think it's way overpriced (sorry!). for the price, it should have its own app, not rely on someone else's (smart life app).great purchase, even if too high priced.","Reviewed in the United States on December 27, 2020",4.0 out of 5 stars,Color: WHITE Wi-FiPattern Name: Infrared Heater
"I have searched everywhere online and with friends and family for help finding a heater that would warm a camper and have not been able to find anything so I just have to say being the first one to do it that so far I am in love with this heater. Although it has only been a few days that I have been using this heater I will update this when it starts getting really cold. But as of right now 10/21/2023 I absolutely love this heater. I live in a 5th Wheel camper so I was worried that I wouldn't be able to find a heater that could not only heat the camper but not run constantly and seeing there is no reviews you really have to do some research. Good news is this heater so far has been amazing. It not only heats the entire 5th wheel but keeps it comfortable. I have mine set to the auto setting at 70° and where the temperature has dropped outside to 30° at night. I have stayed warm without having to find another heat source to accompany it. I also love that it stays cool to the touch above the heating element, back and top of the heater being it is on the ground and I have small dogs that had to be nosey and check it out...lol. One of main concerns when buying this was it flipping the breaker being that it is being used in a camper. This heater does not do that. It runs so quietly, effectively and efficiently. Also if it tips over it does shut off as well. I also like I am able to use other things in my home without worrying about flipping the breaker. Which is a plus in my book. I love that it has 2 lifetime filters on each side that can be easily removed for cleaning and the remote control is a plus also. I like the large LCD screen that is touch screen if you choose not to use the remote which will allow you to accurately choose the temperature that you would like without playing the guessing game. I also like the fact that I am sitting across the room and can feel the heat coming from it. When it gets to the temperature it kicks off and the quiet little fan cools off the heating elements getting it ready for the next cycle. I also like that it does not take very long to heat up my home for example when I leave and I get back and turn it on. Unlike my previous heater which was noisy and took forever it seemed like just to get the chill out of the air. I would definitely recommend this heater for anyone looking to heat a small area under 700 to 1,000 square feet. If at any time my opinion changes for example when it gets really cold outside I will be absolutely certain to update my review but as of today I am so thankful that I bought it. Hopefully if you are a 5th wheel owner like myself and have a well insulated home like mine this will be of help to you also when considering your next purchase of a heater to heat your home.","Reviewed in the United States on October 21, 2023",5.0 out of 5 stars,Color: GREYPattern Name: Infrared Heater
"I have a 14 x 24 ft (single car) insulated garage turned into a game room in the Pacific Northwest. I was considering getting a heat pump to keep the space warm and reduce humidity, but this heater is working really well.I tested the Low and High settings on two consecutive days with similar weather (42°F to 48°F outside) for 4 hours, starting at the same time in the morning. I measured using a separate thermometer/hygrometer placed in a different spot.On the Low setting, the temperature went from 45°F to 62°F, and humidity dropped from 75% to 58%. After 4 hours, it struggled to go past 62°F.Next day, on the High setting, it went from 45°F to 67°F, and humidity dropped from 75% to 53%. After the 4 hours it would hit 70°F+.Even though the garage is insulated it was CRITICAL to address drafts. I filled the small holes in the corners of the garage doors, and I was surprised by how much of a difference that made for efficient heating.Some reviewers commented that the heater's thermometer is way off. You will notice there is nothing wrong with it if the other thermometer you're using to compare is at the same height. Big differences at different heights indicate drafts or poor insulation.Wifi connection works reliably, the power cord doesn't get warm at all, very easy to install. Great buy overall!","Reviewed in the United States on December 13, 2023",5.0 out of 5 stars,Color: WHITE Wi-FiPattern Name: Infrared Heater
"This lil thing is Fantastic!  Have had it bout two months with no problems.  Hint though, heat rises so low on the wall is best.  Keep in mind vacuuming the filters every three to six weeks is also best.  You wont be able to tell the filters need cleaning when they are on the heater, so take them off to look at them.  Very simple with 2 clips.  My wall hasnt even gotten warm and weve run the heck out of it some nights as our room is a bit drafty.  The plus side of this heater is the fan aspect.  Floor heaters and others without this feature dont spread the heat very well so they tend to take longer to heat a room thus become more costly.  This heater is lightish weight, super easy to install, great quality, does its job wonderfully, and its so simple to figure out and take care of.  Will be buying atleast 2 more","Reviewed in the United States on February 28, 2024",5.0 out of 5 stars,Color: WHITE Wi-FiPattern Name: Infrared Heater
"Update 2/12/2022:The heater died sometime during the night and when we woke up, the pump house was down to 36 F and it was 7 F outside.  The heater was still online, but no longer producing heat.  So, the only thing that was reliable on this unit ultimately failed.  Fortunately, we are at the cottage and were able to replace the heater with another one that's not wifi controlled.After replacing the heater, I brought it inside intending to throw it away.  I let it sit for a couple of hours to do other things when I decided that I might be able to salvage the controller and use it to operate another non wifi heater.  I took the front cover off to troubleshoot it to see if it would be easy to reuse the controller and power circuit boards.  I plugged the unit in laying it on its back side with the front cover off and laying upside down next to it. The unit connected to wifi but its tip sensor was activated, so I stood up the black plastic frame and rested the cover on a box that I set up behind it.  I used my phone app to turn it on intending to troubleshoot the problem to see if it was worth salvaging the controller, and, after raising the setpoint to a few degrees above the indoor temperature, I heard a relay click and it started heating.  One heating coil was glowing red and hot air was blowing.  So it was working again.The heater has 2 separate heating coils (I think that's explained in the manual), each with its own relay connected to one end of its corresponding heat coil.  The low setting turns on 1 heating coil and high setting turns on both heating coils.  The other ends of the heating coils are connected together and go through a circuit board thats riveted to the heat duct.  The circuit board contains a 117 deg C thermal cutoff switch and a bi-metallic overtemperature switch wired in series.  Niether of these devices have feedback to the controller.  Consequently, when either of them trips, the coils get disconnected and the heat shuts off.  However, since there's no feedback to the controller regarding the status of these safety switches, the controller has no way of knowing that this happened, so it just keeps going as if nothing is wrong.From the datasheet for the thermal cutoff switch, when it opens, it cannot be reset and must be replaced.  The bi-metallic overtemp switch will reset itself when it cools off to its reset point.  Since letting the heater sit for a couple of hours allowed the heater to work again, I must conclude that the bi-metallic overtemp switch tripped and then cooled off enough to reset after I let it sit.The filter is perfectly clean as is the inside of the unit.  There's not a single spot of dirt or dust anywhere, there are no airflow blockages, and there are no signs of animal activity in the pump house that may have blocked it.  The unit is as clean as when it left the factory.  It is unclear what caused the bi-metallic overtemp switch to trip  I've had it running on the table for almost an hour now, and it's still producing heat, so the overtemp switch isn't tripping.It's hard for me to recommend this heater - especially if you need to rely on it to keep pumps and pipes from freezing.  I can no longer say it's reliable.  It can't tell you when the thermal cutoff switch or bi-metallic overtemp switch have tripped, it randomly loses wifi connectivity when the wifi signal is 3 bars or less, and it's wifi settings can't be remotely configured when connected via bluetooth.  It started out as a promising heater, but turned into an unreliable unit.I intend to keep it since it's working again, but I'm not sure what I'm going to do with it.  This will be my last update.Update 1/22/2022:Turns out that the heater was not connecting to the wifi range extender because the range extender altered the network name.  The range extender split the wifi into 2 new and separate wifi networks, one for each frequency band.  One had _5GEXT appended to the network name for tge 5Ghz band and one with _2.4GEXT appended for the 2.4Ghz band.The range extender's documentation didn't specify that you had to connect to one of those 2 new wifi networks to connect to the extended wifi.  So, it wasn't the heater's fault that it wasn't connecting to the wifi range extender, it was my fault for not figuring that out sooner.At any rate, I still had to pull the heater out of the pump house because adding it using the auto detect via wifi or bluetooth would always fail and I didn't want to mess with it with pump house doors open to the 15 degree outside air.  I brought the heater inside and did a manual add to get it to successfully add under the extender's 2.4Ghz connection.  Then I put it back inside the pump house.  What a pain!At any rate, the heater is no longer complaining about low wifi signal strength.  We will see if the network connection remains stable.  If so, I will restore a 3 star rating.  However, I do want to emphasize that the heater did do its job and kept the pump house warm the whole time.Update 1/6/2022:Unit is offline - AGAIN!  This time I'm at home and 2.5 hrs away from this POS heater.  This is supposed to be one of the coldest nights of the year and this unit has gone offline yet again when I need it to be online. The wifi range extender should be giving it plenty of singal strength as its only 5 feet away on the other side of a wall with nothing but 3.5 inches of insulation and wood between the wifi extender and this POS heater.  This unit is either ignoring the wifi extender, or its unstable wifi network software just eventually fails and needs to be power cycled to reset.  At least my temperature monitor is telling me that the heater is still working.  I'm going to try moving the internet modem/access point closer next time I get up there, but I can't move it very much as it's tethered to a phone line.  I guess I'll need to get a longer phone line.  However, I don't believe moving the access point will make any difference as I've connected reliably to my cottage wifi with my phone outside from 100 feet away through multiple walls.  I suspect this heater's wifi software just sucks.  I've got all kinds of wifi controlled things there from cameras to sensors to furnace thermostats, and NONE of those devices have ANY wifi issues like this POS heater does.Update12/10/2021:Reduced to 1 star.  I tried moving the wifi range extender as close as possible to the pump house and the extender's signal strength was good.  When the heater came back online, I thought everything was OK.  However, when I moved a few feet away, the unit went offline again.  When I moved closer, it came back online.  I used my network scanner to determine that the heater had an IP address and I could ping it, so I knew it had a wifi connection, yet it would only connect when I was close enough.  That's when I realized it was connecting via bluetooth to my phone and showing in the app as connected.  When I shut off my bluetooth, the unit went offline again.  The connection icon in the app should show how it's connected.  It should either display a bluetooth icon or a wifi icon to let you know how it's connected.Next, there is no way to reset the wifi connection via bluetooth.  Being connected via bluetooth is virtually useless, unless you like staying within a few feet of the heater at all times to remotely control it.  I should have been able to fully reset and reconfigure the wifi connectiom using the bluetooth connection.  That would've saved me a lot of work.I was forced to delete the heater from the app, unseal the pump house and attempt to re-add the heater.  Fat lot of good that did!  When I put it into pairing mode, the app couldn't find it!  I was just connected to it via bluetooth, but now it can't find it???  I tried cycling power to no avail.  I had to take it out of the pump house, bring it in, and try again.  Success!  I put it back in the pump house with my bluetooth off and it came back online.  Then I had to re-seal up the pump house.Heat Storm, your network software is very unstable!  Despite that unstable network software, I should have been able to reset the heater's wifi connection via the bluetooth connection.  If I can connect to it via bluetooth, then I should be able to recover the device via bluetooth as well.  I should not have needed to physically access the device to recover it.On a positive note, the heater itself never stopped working and kept my pump house warm.  However the primary point of buying this heater was its remote control capability via wifi.  I'm dropping the rating to 1 star because of the unstable network software.Update 12/4/2021:I downgraded to 3 stars after the unit went offline.  I happened to be at the cottage when the unit started going offline repeatedly and was giving a low wifi signal strength warning.  This happened just as we were leaving the cottage to return home.  I immediately purchased a wifi extender and it seemed to solve the signal strength issue, but every time I opened the app, the unit would show up for 1/2 second as being offline, then would display normally.  It did this every time I closed and then reopened the app.  Note that I have the pump house sealed up, so getting inside requires some effort that I didn't have time for because we had to leave for home.  Unfortunately, by the time we got home, the unit was offline and I no longer have access.  Since the cottage is 2.5 hrs away, this is extremely inconvenient.  At least my backup temperature sensor is still online and its readings indicate that the heater is still functioning, so I'm not concerned that the pipes will freeze, but losing remote access virtually eliminates the reason that I bought this heater in the first place.  Now I will need to unseal the pump house the next time I go there and mess with this heater to get it back online.  Very frustrating.Original review:Right out of the box, the heat output would stop with the displayed temperature about 8 degrees below the setpoint.  I used a YoLink indoor temperature sensor to determine that the heater was shutting off the heat at the correct temperature, it was just the heater displaying the wrong temperature.  I used the heater's thermostat calibration mode to adjust the displayed temperature to match the YoLink's reading and that got it pretty close.  You could also use an instant read meat thermometer as a temperature sensor too.  Note that when doing the calibration, you're not really chaging when the heater shuts off the heat, you're only adjusting what temperature the display reads.  In my case, the YoLink temperature sensor read exactly the same before and after the calibration, it was just the heater's displayed temperature value that changed.To get the heater's displayed temperature to read very close to the actual heat on/off temperature signal that the heater is using to control the heat, refer to the last page in the manual.  There you'll find descriptions of how each heat mode works and at what temperatures it will change the heating power.  Put the heater in high mode and let it run until it feels like its blowing room temperature air.  Enter calibration mode and set the temperature reading to be 2 degrees above the setpoint temperature.  That will get the displayed reading to match closely with the temperature signal the unit is using to control the heat power.You don't have to mount this heater on the wall.  It doesn't get hot to the touch except maybe directly on the outlet grill.  When I was testing it, I had it standing on a 12"" X 24"" slate tile on top of an orange Home Depot bucket.  I ran it on high for 24 hours that way as a test of the unit.  The slate tile was only slightly warmer than room temperature directly in front of heat output register and it was basically room temperature everywhere else on the tile.  The back of the unit never got hot, nor did the plastic front.In my case, I am using the Heat Storm heater to replace the dog house heater that I was using to heat my cottage's insulated well pump house.  The dog house heater proved unable to keep up with the cold on a windy day.  The pump house got down to 34.9 degrees F. That dog house heater didn't have wifi and only had a 300 watt output.  This heater's low power mode is 700 watts and the wifi control allows me to control the pump house temperature remotely.  I have the Heat Storm heater standing on the ground on top of that slate tile that I mentioned earlier in my review as the pump house is too small and tight to wall mount it.  I have a YoLink indoor temperature sensor inside the well pump house that allows me to view the pump house temperature remotely as a backup temperture reading and I have it set to send a notification to my phone when the pump house temperature drops below 45 degrees F.  That's how I found out that the dog house heater wasn't powerful enough to keep up.  So far, the Heat Storm heater is easily able to keep up in low power mode and has been able to maintain the 55 degree F setpoint temperature in the well pump house without any problem.  If it gets cold enough where it doesn't keep up, then I know that I can just increase the setpoint temperature without having to make an emergency trip to the cottage.  And, if low power mode is not enough to keep up, I can switch the Heat Storm to high power mode.The only knock I have against the Heat Storm heater is that its cord is only about 2 or 3 feet long, so it needs to be close to an outlet.  The mfg. doesn't approve of using an extension cord.  This wasn't a problem for me, but it just barely reached the outlet in my pump house, so it might be a problem for you.I've only had this unit running for a few days, but so far it's been great and I'm thinking about getting another one for the cottage's bathroom.","Reviewed in the United States on November 28, 2021",1.0 out of 5 stars,Color: WHITE Wi-FiPattern Name: Infrared Heater
I use this in a 17x19 uninsulated sunroom room in the winter to host our annual party to give us more space and this heater GETS THE JOB DONE. Both years in a row we have had to turn the heater off because it was working so well and people were so hot. I also use this to regulate the temperature in our sunroom come early April to start my seedlings and it works wonders. It has an internal thermostat and regulates itself. I would absolutely recommend. We bought ours 2 years ago and the one just purchased was by my aunt who has a live in suite in the basement and struggles with temperature control and this surpassed her expectations and her space is double of  the dimensions mentioned above.,"Reviewed in the United States on April 30, 2024",5.0 out of 5 stars,Color: WHITE Wi-FiPattern Name: Infrared Heater
